abstract,authors,n_citation,references,title,venue,year,id
"In this paper, a robust 3D triangular mesh watermarking algorithm based on 3D segmentation is proposed. In this algorithm three classes of watermarking are combined. First, we segment the original image to many different regions. Then we mark every type of region with the corresponding algorithm based on their curvature value. The experiments show that our watermarking is robust against numerous attacks including RST transformations, smoothing, additive random noise, cropping, simplification and remeshing.","['S. Ben Jabra', 'Ezzeddine Zagrouba']",50,"['09cb2d7d-47d1-4a85-bfe5-faa8221e644b', '10aa16da-3cc8-4af6-9d66-48037e915d76', '35cb45c3-9408-4096-ab30-bc2e4de3fb5d', '661a342e-a911-4420-b67d-51c75d3b14e9', '779553f3-e4c1-456e-bc01-5eb9d9567541', 'b24ba5c0-fee8-4a3e-9330-17f6564856cd', 'fd1c676d-1296-4f19-89b4-17c7ecd270f3']",A new approach of 3D watermarking based on image segmentation,international symposium on computers and communications,2008,4ab3735c-80f1-472d-b953-fa0557fed28b
"We studied an autoassociative neural network with dynamic synapses which include a facilitating mechanism. We have developed a general mean-field framework to study the relevance of the different parameters defining the dynamics of the synapses and their influence on the collective properties of the network. Depending on these parameters, the network shows different types of behaviour including a retrieval phase, an oscillatory regime, and a non-retrieval phase. In the oscillatory phase, the network activity continously jumps between the stored patterns. Compared with other activity-dependent mechanisms such as synaptic depression, synaptic facilitation enhances the network ability to switch among the stored patterns and, therefore, its adaptation to external stimuli. A detailed analysis of our system reflects an efficient-more rapid and with lesser errors-network access to the stored information with stronger facilitation. We also present a set of Monte Carlo simulations confirming our analytical results.","['Joaquín J. Torres', 'Jesús M. Cortés', 'Joaquín Marro', 'Hilbert J. Kappen']",50,"['4017c9d2-9845-4ad2-ad5b-ba65523727c5', 'b1187381-cc24-471e-b288-5da09c3d4ca9', 'ecf8e7f0-cac6-47e4-9c29-f4241b0e1d7a']",Attractor neural networks with activity-dependent synapses: The role of synaptic facilitation,Neurocomputing,2007,4ab39729-af77-46f7-a662-16984fb9c1db
"It is well-known that Sturmian sequences are the non ultimately periodic sequences that are balanced over a 2-letter alphabet. They are also characterized by their complexity: they have exactly $(n+1)$ distinct factors of length $n$. A natural generalization of Sturmian sequences is the set of infinite episturmian sequences. These sequences are not necessarily balanced over a $k$-letter alphabet, nor are they necessarily aperiodic. In this paper, we characterize balanced episturmian sequences, periodic or not, and prove Fraenkel's conjecture for the special case of episturmian sequences. It appears that balanced episturmian sequences are all ultimately periodic and they can be classified in 3 families.","['Genevi eve Paquin', 'Laurent Vuillon']",50,"['1c655ee2-067d-4bc4-b8cc-bc779e9a7f10', '2e4e57ca-d190-4bc7-b7ad-2e33aca2f574', '508ea83a-035b-4542-a315-9247c172d255', '666a65af-8657-43f6-b765-f2b72a16726a', '8100bfb7-3f6a-4269-bba8-7c4a6a578570', '8e035cc6-d692-4532-bb3c-a6a34b4db83a', 'e10a00d9-bb59-4f19-8f1c-85917bc03b5f']",A characterization of balanced episturmian sequences,Electronic Journal of Combinatorics,2007,4ab3a4cf-1d96-4ce5-ab6f-b3e19fc260de
"One of the fundamental challenges of recognizing actions is accounting for the variability that arises when arbitrary cameras capture humans performing actions. In this paper, we explicitly identify three important sources of variability: (1) viewpoint, (2) execution rate, and (3) anthropometry of actors, and propose a model of human actions that allows us to investigate all three. Our hypothesis is that the variability associated with the execution of an action can be closely approximated by a linear combination of action bases in joint spatio-temporal space. We demonstrate that such a model bounds the rank of a matrix of image measurements and that this bound can be used to achieve recognition of actions based only on imaged data. A test employing principal angles between subspaces that is robust to statistical fluctuations in measurement data is presented to find the membership of an instance of an action. The algorithm is applied to recognize several actions, and promising results have been obtained.","['Yaser Sheikh', 'Mumtaz Sheikh', 'Mubarak Shah']",221,"['056116c1-9e7a-4f9b-a918-44eb199e67d6', '05ac52a1-dfa2-4c32-9a54-6c1e58cfcca5', '0b2f71cc-6797-445a-82df-5be29945c0a7', '60cf9842-c3aa-463d-a5cf-17fbb8f99ccd', '7a3bb575-8313-4e77-a008-ee5cde444746', '7eda9b91-21f1-490f-8ef2-f94e81c558a4', '905461e4-643b-4da0-a669-f52318b9e126', 'be336575-9974-411d-b637-45440213cbd4', 'be9527aa-97e2-4951-86d1-cc6130cbb777', 'f0d57def-3340-49be-a1c3-cbc996af8dec']",Exploring the space of a human action,international conference on computer vision,2005,4ab3a98c-3620-47ec-b578-884ecf4a6206
"This paper generalizes previous optimal upper bounds on the minimum Euclidean distance for phase shift keying (PSK) block codes, that are explicit in three parameters: alphabet size, block length a ...","['Efraim Laksman', 'Håkan Lennerstad', 'Magnus Nilsson']",0,"['01a765b8-0cb3-495c-996f-29c36756b435', '5dbc8ccb-0014-4cb8-b720-e2a5b44b671d', '71ea2d72-eb37-409e-af69-04e50a01dc57', '79c988db-c749-4a4a-87a3-d56efc360ec8', '96da5fa5-ba62-49cc-a501-b17321433a08', 'b78483f4-dff7-4858-8eb2-287bc6c39012', 'e325951d-4375-4f15-b0cb-e0bd92e02008', 'ee0a0cc0-609b-4774-965c-4a8d38af8400', 'fc2571ef-0ad1-49bc-b91f-caf8de23adb0']",Generalized upper bounds on the minimum distance of PSK block codes,Ima Journal of Mathematical Control and Information,2015,4ab3b585-82b4-4207-91dd-b6bce7e27c4e
"Queueing networks with multiple classes of customers play a fundamental role for evaluating the performance of both software and hardware architectures. The main strength of product–form models, in particular of BCMP queueing networks, is that they combine a flexible formalism with efficient analysis techniques and solution algorithms. In this paper we provide an algorithm that starting from a high–level description of a system, and from the definition of its components in terms of interacting sub–systems, computes a multiple–class and multiple–chain BCMP queueing network. We believe that the strength of this approach is twofold. First, the modeller deals with simplified models, which are defined in a modular and hierarchical way. Hence, we can carry on sensitivity analysis that may easily include structural changes (and not only on the time parameters). Second, maintaining the product–form property allows one to derive the average system performance indices very efficiently. The paper also discusses the ...","['Simonetta Balsamo', 'Gian–Luca Dei Rossi', 'Andrea Marin']",6,"['1c26e228-57d2-4b2c-b0c9-8d5851c17fac', '75399207-1568-4ee7-ba52-ef10f26add66', '85244323-5e23-4e8b-86f5-7ac94efeb41a', '8feb6edc-fb79-42ef-8b1f-0bdad35d32d6', 'af481f6f-28ed-450b-97ab-90053e681184', 'db568ebb-0611-468b-81cc-c1443de40c14', 'fd0827cd-5709-4048-94fd-572968165b1e']",Applying BCMP multi-class queueing networks for the performance evaluation of hierarchical and modular software systems,International Journal of Computer Aided Engineering and Technology,2015,4ab3e768-78c9-4497-8b8e-9e934cb5f2e4
"A CMOS oscillator employing differential transistor pairs working in Class-C in push-pull configuration is presented. The oscillator exhibits the same advantages enjoyed by complementary topologies on oscillators based on a single differential pair, while yielding a substantial power consumption reduction thanks to the Class-C operation. The phase-noise performance and the fundamental conditions required to keep the transistors working in Class-C are analyzed in detail. It is shown that, for an optimal performance, both nMOS and pMOS transistors should not be pushed into the deep triode region by the instantaneous resonator voltage, and a simple circuit solution is proposed to accommodate a large oscillation swing. A 0.18- μm CMOS prototype of the (voltage-controlled) oscillator displays an oscillation frequency from 6.09 to 7.50 GHz. The phase noise at 2-MHz offset is below -120 dBc/Hz with a power dissipation of 2.2 mW, for a state-of-the-art figure-of-merit ranging from 189 to 191 dBc/Hz.","['Andrea Mazzanti', 'Pietro Andreani']",50,"['0a09db01-264a-4bdf-942c-d33cceb35d3c', '36c942df-7fcb-40b8-b023-a3a4001f632e', '84c00b06-a611-4082-89f7-df2d5540d210', 'a5496509-ebaf-472b-bc83-2e7c503e55bf', 'b8b564ca-0651-4fd4-8db0-0f7710e25ce1', 'bb1ed638-e3c3-46f7-adf9-6977afca564a', 'e3a35338-4747-46f7-b752-5690a5c3c84a', 'f277b0e7-3f23-4a22-ac17-fc6c6019c664']",A Push–Pull Class-C CMOS VCO,IEEE Journal of Solid-state Circuits,2013,4ab3f7cd-140b-4e29-99d4-f4e8006c4f65
"In statistical setting of the pattern recognition problem the number of examples required to approximate an unknown labelling function is linear in the VC dimension of the target learning class. In this work we consider the question whether such bounds exist if consider only computable pattern recognition methods, assuming that the unknown labelling function is also computable. We find that in this case the number of examples required for a computable method to approximate the labelling function not only is not linear, but grows faster (in the VC dimension of the class) than any computable function. No time or space constraints are put on the predictors or target functions; the only resource we consider is the training examples.#R##N##R##N#The task of pattern recognition is considered in conjunction with another learning problem — data compression. An impossibility result for the task of data compression allows us to estimate the sample complexity for pattern recognition.",['Daniil Ryabko'],2,['505f493b-e09d-444d-9ee2-5e5db6a5b8ac'],On computability of pattern recognition problems,algorithmic learning theory,2005,4ab404e2-6f4b-4fb4-b093-50775e765b13
"We first discuss some general aspects of micromanipulation and possible different approaches. Then, we present new results in the micromanipulation of mechanical and biological objects. The apparatus we use is a purposely developed workstation comprising macro- and micro-manipulators. The most innovative component of the workstation is a micro-gripper fabricated using LIGA technology and actuated by piezoelectric actuators. We describe the design, fabrication and performance of a few prototypes of LIGA micro-grippers. Results are presented which demonstrate the ability of the system to manipulate effectively both micro-mechanical and biological micro-objects.","['Maria Chiara Carrozza', 'Paolo Dario', 'Arianna Menciassi', 'A. Fenu']",50,"['5ecd70e1-7ccc-4b2f-ac09-b91953cca5cd', '7fa711e9-0010-47a7-8194-9e94e70774b3', '95fbcb46-d829-453b-8c74-d691150c7eac', 'dade067a-8767-4258-8a1d-4f27f2be4f61']",Manipulating biological and mechanical micro-objects using LIGA-microfabricated end-effectors,international conference on robotics and automation,1998,4ab4244d-fb3e-49a3-b125-367df3d8e6ba
,"['Zhanjun Bai', 'Xing Zhou', 'Ralph Mason']",3,"['54f270aa-ce44-4ece-a2ca-c63a9f266cb3', '638c4886-71ab-4765-81c8-1ee65f05d7b5', 'ca16d866-0d02-4928-91ef-ed70e8bb6381']",A novel Injection Locked Rotary Traveling Wave Oscillator,international symposium on circuits and systems,2014,4ab439a4-9379-44f5-b98b-87125ae7366e
"In 1999, Iwan Duursma defined the zeta function for a linear code as a generating function of its Hamming weight enumerator. It can also be defined for other homogeneous polynomials not corresponding to existing codes. If the homogeneous polynomial is invariant under the MacWilliams transform, then its zeta function satisfies a functional equation and we can formulate an analogue of the Riemann hypothesis. As far as existing codes are concerned, the Riemann hypothesis is believed to be closely related to the extremal property. In this article, we show there are abundant polynomials invariant by the MacWilliams transform which satisfy the Riemann hypothesis. The proof is carried out by explicit construction of such polynomials. To prove the Riemann hypothesis for a certain class of invariant polynomials, we establish an analogue of the Enestrom-Kakeya theorem.",['Koji Chinen'],0,"['02d38c7d-3baf-40e3-86d7-a8884ff503f4', '078e6ac3-f385-42e2-a966-5ca05b98588a', 'b06b90e7-36f4-418a-82b2-656645469cf6', 'b86d2872-8125-4909-957a-d1e0f9cacb90']",An abundance of invariant polynomials satisfying the Riemann hypothesis,Discrete Mathematics,2008,4ab459ce-5f18-4cc0-9627-1dc557eb8b68
"Entity Resolution (ER) is the problem of identifying which records in a database refer to the same real-world entity. An exhaustive ER process involves computing the similarities between pairs of records, which can be very expensive for large datasets. Various blocking techniques can be used to enhance the performance of ER by dividing the records into blocks in multiple ways and only comparing records within the same block. However, most blocking techniques process blocks separately and do not exploit the results of other blocks. In this paper, we propose an  iterative blocking framework  where the ER results of blocks are reflected to subsequently processed blocks. Blocks are now iteratively processed until no block contains any more matching records. Compared to simple blocking, iterative blocking may achieve higher accuracy because reflecting the ER results of blocks to other blocks may generate additional record matches. Iterative blocking may also be more efficient because processing a block now saves the processing time for other blocks. We implement a scalable iterative blocking system and demonstrate that iterative blocking can be more accurate and efficient than blocking for large datasets.","['Steven Euijong Whang', 'David Menestrina', 'Georgia Koutrika', 'Martin Theobald', 'Hector Garcia-Molina']",211,"['0b5e0bfa-12ff-4175-9d65-d8cc62552ae6', '2cba753f-24b1-4b6c-8d36-b9bf66bd1477', '33d18bee-c873-4cf5-8962-e79a032cbdf3', '3960350c-fc91-4fae-83f3-69899d9c8a6f', '5d57c4fa-8dda-4e92-b42b-67f8d16f8602', '717f3af1-aa86-41db-90e5-bfb94ecf8616', '71e35609-693a-4036-9bac-861a7ce7c868', '76c1da70-2949-47c3-aefa-9d703c884cd3', '78001688-d865-4fda-a2eb-d5097c93bbb9', '866e99e1-f1d4-4be9-be12-1f3fe444fc52', '8cf0f572-0507-48cf-9ada-37c152f5810f', '99ac2c24-4d9a-4a96-a9a7-4ada6393677e', '9ff322c1-64c8-49e5-9c23-4b380eff5f10', 'b123d7d1-cced-41cc-a8fc-c710a8f8a736', 'b22383b0-6528-4156-9069-472d895438c3', 'b55b3100-5054-4d25-860d-d3e32fc56d14', 'c9b221ed-7083-4ae7-835c-8e8bd5af22ec', 'fb565ef1-0650-4e55-b68a-1936d8ddb188']",Entity resolution with iterative blocking,international conference on management of data,2009,4ab46288-3a29-471f-95c9-9926df1f93ce
"Performance analysts profile their programs to find methods that are worth optimizing: the ""hot"" methods. This paper shows that four commonly-used Java profilers ( xprof , hprof , jprofile, and yourkit ) often disagree on the identity of the hot methods. If two profilers disagree, at least one must be incorrect. Thus, there is a good chance that a profiler will mislead a performance analyst into wasting time optimizing a cold method with little or no performance improvement.   This paper uses causality analysis to evaluate profilers and to gain insight into the source of their incorrectness. It shows that these profilers all violate a fundamental requirement for sampling based profilers: to be correct, a sampling-based profilermust collect samples randomly.   We show that a proof-of-concept profiler, which collects samples randomly, does not suffer from the above problems. Specifically, we show, using a number of case studies, that our profiler correctly identifies methods that are important to optimize; in some cases other profilers report that these methods are cold and thus not worth optimizing.","['Todd Mytkowicz', 'Amer Diwan', 'Matthias Hauswirth', 'Peter F. Sweeney']",95,"['0b279971-aa22-4622-aaf5-5cd6d4f70756', '16f8c89c-8c1a-42cf-b6d6-2f0e4da11cfe', '183292a9-9b90-4bdd-82c4-cd9c98062d18', '3039a487-91b5-4f34-877f-022722657c58', '398ae890-8f2a-466a-b11b-86036a5d2bdf', '4c574894-82ec-4700-9a37-baf19bfedadd', '56dd2783-44fe-40aa-9638-3bcfb239221d', '68893220-6f06-4f2f-90b1-072d481cbcc1', '6bcc6079-7981-47fe-b1dd-9aaf3656bf28', '70bbc8f5-86c6-4c24-8cf9-154e167fc299', '97c56b66-bc7f-46a0-a084-0368ac55a282', 'a3039605-5311-4cdf-b462-efa42ca26116', 'b2f15cc8-672a-4862-a1d7-b30314ff89de', 'c15db488-8900-4ec7-9b27-d092172d5360', 'c638ee07-dfad-4609-9ba5-647c939f55a4', 'eb468120-46b4-4523-a297-67f535d4f9af']",Evaluating the accuracy of Java profilers,programming language design and implementation,2010,4ab4c0a1-3c5a-44c6-bdd4-3a0618d303ca
"In motion-compensated video-coding schemes, such as MPEG, an I frame is normally followed by several P frames and possibly B frames in a group-of-picture (GOP). In error-prone environments, errors happening in the previous frames in a GOP may propagate to all the following frames until the next I frame, which is the beginning of the next GOP. In this paper, we propose a novel GOP structure for robust transmission of MPEG video bitstream. By selecting the optimal position of the I frame in a GOP, robustness can be achieved without reducing any coding efficiency. Experimental results demonstrate the robustness of the proposed GOP structure.","['Tao Fang', 'Lap-Pui Chau']",1,"['15430dbb-9ce8-4e7a-a112-678cdf1f1c28', '750b4963-83ac-4759-b816-4aa6a4f0b4ea', 'c05b713d-7c58-4ecf-ac74-3a917ccb2352']",Robust group-of-picture architecture for video transmission over error-prone channels,international symposium on circuits and systems,2005,4ab4c17b-a9ac-4f37-8e71-5977d5db5a07
"Most of us have taken the exact rational and approximate numbers in our computer algebra systems for granted for a long time, not thinking to ask if they could be significantly better. With exact rational arithmetic and adjustable-precision floating-point arithmetic to precision limited only by the total computer memory or our patience, what more could we want for such numbers? It turns out that there is much more that can be done that permits us to obtain exact results more often, more intelligible results, approximate results guaranteed to have requested error bounds, and recovery of exact results from approximate ones.",['David R. Stoutemyer'],6,"['12a6a20f-d96b-4761-a704-2182aa7e61ef', '69319909-d747-49df-bbcb-266b4a1ccc19', '7a484ff1-feeb-4e17-be20-3ddb72f968f4', '826ec29f-e225-4e84-a64f-4d9c8f8f3c0b', '9847a01c-b2e6-4a50-8c51-9515048eb2e5', 'a957f7ca-f301-42e2-bff7-ecb98c484875', 'ca7cb307-25d2-43a9-9e8d-cd2529f3b1c1', 'dde461c7-3f28-4ae9-99e0-0aca4c089785']",Useful computations need useful numbers,ACM Communications in Computer Algebra,2007,4ab4e2a8-18c5-47a0-a295-a63dc68a49ab
"This paper addresses the problem of retargeting, namely adapting large source images for effective viewing at a smaller size with possible applications to PDAs, or dynamic page layouts. Instead of extracting regions of interest for retargeting, the uninteresting parts are removed from the scene in Shai Avidan and Shamir, A. (2007). This is done by computing the RGB variance within non-overlapping 3times3 blocks and removing the block path with minimal variance cost using dynamic programming. It is shown that transformation to CIELAB space is more effective for visual interpretation of image content. The implementations are shown to be much faster than the seam carving approach of Shai Avidan and Shamir, A. (2007). Schemes are also presented for speeding up the seam carving scheme itself.","['Awadhesh Srivastava', 'Kanad K. Biswas']",50,"['517f023f-4d1f-4f6d-96a3-7638f86b34d8', '6a5e9cd0-60f9-4623-ac93-6bc92d505b6a', '87daf2ac-471c-4267-9ab7-cced94e06e1b', 'a3b3ecce-5921-47ec-a21b-80a8cb1939b8', 'bc0310e3-c11d-4f2d-9bc4-e8a3b10ca18c', 'd979fb54-f1ee-4240-bfea-e37f76819c3c', 'e7978e39-122b-48db-a98c-1cff042f42c9']",Fast Content Aware Image Retargeting,,2008,4ab503e2-d7b4-441e-8e0e-edf1b9bfb602
"Scalable storage architectures allow for the addition of disks to increase storage capacity and/or bandwidth. In its general form, disk scaling also refers to disk removals when either capacity needs to be conserved or old disk drives are retired. Assuming random placement of blocks on multiple nodes of a continuous media server, our optimization objective is to redistribute a minimum number of media blocks after disk scaling. This objective should be met under two restrictions. First, uniform distribution and hence a balanced load should be ensured after redistribution. Second, the redistributed blocks should be retrieved at the normal mode of operation in one disk access and through low complexity computation. We propose a technique that meets the objective, while we prove that it also satisfies both restrictions. The SCADDAR approach is based on using a series of REMAP functions which can derive the location of a new block using only its original location as a basis.","['Ashish Goel', 'Cyrus Shahabi', 'Shu-Yuen Didi Yao', 'Roger Zimmermann']",70,"['1d950f41-7ecc-4243-a2bc-e91242887637', '57868e44-9a01-488a-989f-fd18a57a790f', '60e1ce59-a6a3-49dc-9727-3c02d166188a', '72f144d2-8bfc-4eb1-ba37-8cf9ef190a52', '73c49f25-1710-42b9-bc25-e12c3d47f3de', '756dc97f-4124-4692-bf08-c227c4d6d58f', '9e0fc090-adfe-4482-a1a0-b7037922db10', 'a5385305-4572-443e-bcaa-1297e87aaabb', 'ad9ae838-b7be-4c54-9536-1ba11cf2ff92', 'befc800b-996e-4798-b300-303126ad8fd8', 'e3fc9188-4c99-404e-a22c-7ae7413f0238', 'fd8e4a2e-4e59-4c80-982f-d7ac6db3fe54']",SCADDAR: an efficient randomized technique to reorganize continuous media blocks,international conference on data engineering,2002,4ab50bd7-8e59-4974-a6d0-59a577dcc10d
"Rare event simulation for stochastic models of complex systems is still a great challenge even for Markovian models. We review results in importance sampling for Markov chains, provide new viewpoints and insights, and we pose some future research directions.",['Werner Sandmann'],10,"['1fbce743-ee10-495e-b67f-700928b3cfc0', '5481cf9f-d3ba-425e-9d74-82b2b7d1af52', 'b45c1b9e-bbb6-4d98-abb7-15cf21df5cac', 'ca3e835e-bbdd-4998-81a2-364ecbda14a2']",Importance sampling in Markovian settings,winter simulation conference,2005,4ab50fd5-e0e8-44aa-acf1-a7a131293e7c
"Freezing tolerance in plants is obtained during a period of low nonfreezing temperatures before the winter sets on, through a biological process known as cold acclimation. Cold is one of the major stress factors that limits the growth, productivity and distribution of plants, and understanding the mechanism of cold tolerance is therefore important for crop improvement. Expressed sequence tags (EST) analysis is a powerful, economical and time-efficient way of assembling information on the transcriptome. To date, several EST sets have been generated from cold-induced cDNA libraries from several different plant species. In this study we utilize the variation in the frequency of ESTs sampled from different cold-stressed plant libraries, in order to identify genes preferentially expressed in cold in comparison to a number of control sets. The species included in the comparative study are oat (Avena sativa), barley (Hordeum vulgare), wheat (Triticum aestivum), rice (Oryza sativa) and Arabidopsis thaliana. However, in order to get comparable gene expression estimates across multiple species and data sets, we choose to compare the expression of tentative ortholog groups (TOGs) instead of single genes, as in the normal procedure. We consider TOGs as preferentially expressed if they are detected as differentially expressed by a test statistic and up-regulated in comparison to all control sets, and/or uniquely expressed during cold stress, i.e., not present in any of the control sets. The result of this analysis revealed a diverse representation of genes in the different species. In addition, the derived TOGs mainly represent genes that are long-term highly or moderately expressed in response to cold and/or other stresses.","['Angelica Lindlöf', 'Marcus Bräutigam', 'Aakash Chawade', 'Björn Olsson', 'Olof Olsson']",0,"['9b8ad98f-1db8-4201-8246-cbc0812606d8', 'e5b94864-84e2-4833-9df5-6189c844654a']",Identification of cold-induced genes in cereal crops and arabidopsis through comparative analysis of multiple EST sets,bioinformatics research and development,2007,4ab54610-4947-46c7-bd56-fc672dfba5cc
