abstract,authors,n_citation,references,title,venue,year,id
"This position paper concerns itself with real-time safety critical distributed systems. It presents a computational model that is appropriate for this type of application and architecture. It then defines a resource allocations scheme based upon fixed priority scheduling. Such a scheme has the advantage (over purely static schedules) of supporting greater levels of flexibility and non-determinism, whilst still providing static guarantees of necessary timing behaviour (i.e. end-to-end deadlines through the systems). Priority based communication protocols are investigated, with possible future techniques reviewed.","['Alan Burns', 'Neil C. Audsley', 'Andy J. Wellings']",50,"['236bbbbd-56a9-41fa-a880-d33ab6c40c78', '2e07a585-5f68-449d-8df9-17195a2dc8cc', '409d59aa-c331-4b07-b727-b554163601a0', '5711cebd-8ff8-4e69-981c-69f7b322bf9f', '6536b436-fd22-4b16-a18a-b75776f74662', '6a6b9aa6-683f-4c7c-b06e-9c3018d10fd3', '7a5ac1d8-567b-4cbd-a8fe-a84c11f6028e', '80ef8d5d-a257-415f-9bc0-ddc6c983c9a0', '84568b81-5f5b-4ea0-a6f9-8d6c292bfea7', '9a0d9ce5-5d3c-498f-8151-0e8d28b9f95d', 'b8fecde6-b1e2-40ce-865c-8c6280f2f4ef', 'bd47ea56-6d12-44a5-9e42-8b259e8b25cb', 'c0968280-a735-40f7-9457-2be057c76c26', 'd7eb74d3-04a3-476b-8e3d-563f6729ca3b', 'd89afe5d-96c6-4839-be2f-8c80c4b00a1d', 'dd272406-41b7-435d-9688-97e297481583']",Real-time distributed computing,,1995,4ab5585e-6a6a-4c92-b37c-e4dbb67fe72e
"a b s t r a c t The constant pressure–temperature (P–T) flash plays an important role in the modelling of fluid-phase behaviour, and its solution is especially challenging for equations of state in which the volume is expressed as an implicit function of the pressure. We explore the relative merits of solving the P–T flash in two ensembles: mole numbers, pressure and temperature, in which each free-energy evaluation requires the use of a numerical solver; and mole numbers, volume and temperature, in which a direct evaluation of the free-energy is possible. We examine the performance of two algorithms, HELD (Helmholtz free energy Lagrangian dual), introduced in Pereira et al. (2012), and GILD (Gibbs free energy Lagrangian dual), introduced here, for the fluid-phase equilibria of 8 mixtures comprising up to 10 components, using two equations of state. While the reliability of both algorithms is comparable, the computational cost of HELD is consistently lower; this difference becomes increasingly pronounced as the number of components is increased. © 2014 The Authors. Published by Elsevier Ltd. This is an open access article under the CC BY license","['Frances E. Pereira', 'Amparo Galindo', 'George Jackson', 'Claire S. Adjiman']",5,"['0983ec0b-f922-4c60-aac5-64f720fab210', '1aad0bde-f799-47d8-8768-b08479054da5', '3ec721be-4971-434a-8a18-de860c17b468', '41b18372-581c-4502-844a-495967a12511', '71ab8922-400d-40fc-904e-f1e239bb3649', '82b175a5-b213-47a2-b0af-1d69e685841c', '9038e412-fed4-446a-b3be-a76fefda37ff']",On the impact of using volume as an independent variable for the solution of P-T fluid-phase equilibrium with equations of state,Computers & Chemical Engineering,2014,4ab572c2-c224-4d2e-832b-8bd440ed4da1
"The OntoNL Framework provides an architecture and re-usable components for automating as much as possible the building of natural language interfaces to information systems. In addition to the syntactic analysis components, OntoNL has semantic analysis components which exploit domain ontologies to provide better disambiguation of the user input. We present in this paper the algorithms used for semantic processing of the natural language queries, as well as an ontology-driven semantic relatedness measure developed for this purpose. We also present extensive evaluation results with different ontologies using human subjects.","['Anastasia Karanastasi', 'Stavros Christodoulakis']",5,"['06a739f6-4696-4f33-9788-7ecfd2aabc27', '11d6d688-f542-4d4e-8a9e-50150c7f08e3', '3b77dbae-bca0-4b52-8009-c25492ea2a31', '45a3a270-c470-4d57-8573-48aab220ac7b', '4a23bcc9-2320-4889-b7c3-6c01f4204051', '4d78f831-690a-4cc2-870a-c97f82af1d68', '54c5d63d-1e4b-48ec-9d8b-33b52d274aaa', '5a5dabe5-fd5e-4b5c-a199-3d39e541a052', '7d8b89ee-ec9a-4584-8259-20267d8dc0a6', '892d5d27-8e30-4ab2-b157-3eb1639e2a1d', '89f7c1b8-fd2a-41db-bb13-9bdaf250a746', 'd5fe2cc9-2cda-4b6f-b551-46b9b47b99b5']",Semantic Processing of Natural Language Queries in the OntoNL Framework,international conference on semantic computing,2007,4ab57ebc-8bdf-4f3b-91c8-c20756fce04a
"This study compares a linear keyword language interface and a restricted natural language interface for data retrieval by a novice user. The comparison focuses on the effect of different data base interfaces on user performance as measured by query correctness and query writing time in a query writing task across varying query types and training levels. To accomplish this objective, a laboratory experiment was conducted using a split-plot factorial design using two between-subjects factors and one within-subjects factor. The results indicate that the restricted natural language subjects performed significantly better than the linear keyword language subjects in terms of both query correctness and query writing time.","['Kil Soo Suh', 'A. Milton Jenkins']",33,"['02ceec2a-77e5-4f0b-a0a1-a6869b7d580a', '11aceee0-863e-4bae-81d1-899bc1edaac3', '42ef7bbd-7370-4e33-bfef-776b94137618', '67f8a6d7-34d4-47f5-a9a5-a6be613280e2', '7e219fae-4077-40ed-aaad-218c9eb93009', '9967cd2b-0616-49e6-85f9-21b972d2580d', 'ca43b3c2-8f15-4c01-a5b6-c6a9d0b3277a', 'f48d5699-3965-4b84-a609-569c9f529ad6', 'f5a9c9bf-824a-4290-b5d8-69dac9dc63bb', 'f648858a-a8a7-4371-953c-7c1396748791']",A Comparison of Linear Keyword and Restricted Natural Language Data Base Interfaces for Novice Users,Information Systems Research,1992,4ab59e6c-fa3b-4529-bc39-00da61e0afc4
"Virtual position-based routing protocols have many attractive characteristics for wireless sensor networks. Typically, such protocols use a proactive scheme for updating routing tables. Because sensor networks can have very low data rate, sending periodic beacons to update routing tables can be very expensive. Instead, reactive approaches might be more appropriate in such scenarios. MANET-inspired reactive routing protocols do not scale well because of the effort in the order of O(n) for each routing information update. In this paper, we present Reactive Virtual Cord Protocol (RVCP), a data-centric reactive virtual position based routing protocol for use in sensor networks. Route discovery is directed towards the destination and hence there is no need to flood the entire network to discover a route. Our approach is based on Virtual Cord Protocol (VCP), an efficient, virtual relative position based routing protocol that also provides support for data management as known from typical Distributed Hash Table (DHT) services. To minimize the end-to-end delay and energy consumption, we used adaptive techniques for the development of RVCP.","['Abdalkarim Awad', 'Andreas Mitschele-Thiel', 'Falko Dressler']",1,"['0d4d0363-07b5-43b6-976d-955e96044709', '29424b9c-c448-4679-8472-044e701a11ea', '2f4e35f1-6dca-46f6-8157-980564a94da0', '3382adea-17b5-4515-a0a7-043f78493e0e', '5bbcc50b-0f4b-4c51-8487-0630f8400f61', '60fb0dc2-bde3-4714-948e-de0ed12ab460', '6288f6da-12ac-4f71-b3dd-37fe580b6793', '6bb012bc-9e9e-4b8d-8098-9b972e612593', '7bd442a1-fb27-4e38-8635-d4c0367f3e2d', '7d42815c-daac-4c27-a9a3-39bd29536fed', '7f9d2a8a-12d1-4944-8c82-99eade0d7442', '8ee59530-fc2a-4b2f-92d0-c241e654f52c', 'ada4eba5-6923-4b92-bf17-9fd360a90b14', 'd381281a-14a0-4d73-993f-723a06096a09', 'e52fc0f5-b2e0-4ecc-a145-3e4e20178da8']",Reactive Virtual Position-Based Routing in Wireless Sensor Networks,international conference on computer communications and networks,2011,4ab5d145-0ea8-49b5-b517-93677e7cbe88
"This paper considers a problem of coupled task scheduling on one processor, where all processing times are equal to 1, the gap has exact length h, precedence constraints are strict and the criterion is to minimise the schedule length. This problem is introduced e.g. in systems controlling radar operations. We show that the general problem is NP-hard.","['Jacek Blazewicz', 'Klaus Ecker', 'Tamás Kis', 'Michal Tanas']",14,,A note on the complexity of scheduling coupled tasks on a single processor,Journal of the Brazilian Computer Society,2001,4ab5db5e-7a0c-4c67-a3c5-b9e5c73f54b2
"In this paper, a weighting-delay-based method is developed for the study of the stability problem of a class of recurrent neural networks (RNNs) with time-varying delay. Different from previous results, the delay interval [0, d(t)] is divided into some variable subintervals by employing weighting delays. Thus, new delay-dependent stability criteria for RNNs with time-varying delay are derived by applying this weighting-delay method, which are less conservative than previous results. The proposed stability criteria depend on the positions of weighting delays in the interval [0, d(t)], which can be denoted by the weighting-delay parameters. Different weighting-delay parameters lead to different stability margins for a given system. Thus, a solution based on optimization methods is further given to calculate the optimal weighting-delay parameters. Several examples are provided to verify the effectiveness of the proposed criteria.","['Huaguang Zhang', 'Zhenwei Liu', 'Guang-Bin Huang', 'Zhanshan Wang']",266,"['11560f85-2543-466f-b338-5ef10a073db7', '14feaffa-1566-44d0-b798-80c027655c1a', '2b258346-2416-4156-abcf-f8f3c3bc99c4', '36739ece-b2b9-4c95-8e96-e1135048101c', '38d20ba0-db8e-47db-ab6b-f2898683a0a1', '4b782405-24db-456f-a058-2b8fd79ea3db', '56d975c5-f372-4eee-8667-1cae480cb57c', '669f9f47-d6bf-462e-b2a6-8300ac07835b', '714a8cc0-486f-4259-bb81-66b5f248e016', '758bcb76-b6a4-415b-8403-1fcd1a8c5643', 'b5af1799-bc84-45f5-823c-193b846455d7', 'b6bbf822-292c-4dfa-a98b-d61b798446cc', 'b76d4f7b-2eac-4eae-8a9d-bd21123e4356', 'bee7d6d4-1d2f-4b8b-951e-466c8e67785b', 'd32e8c91-9c64-438b-bee6-2c89ddb2db0a', 'd8263bb4-5ecb-454a-96b0-fb9a84be03b9', 'dc0ffeb4-7087-4f36-b599-43bb8de95ad1', 'f40a5ee9-78d1-40c9-ae7f-bc4cfc143624', 'f93b2e01-ba5c-47c3-94f3-de9ac10991d9']",Novel Weighting-Delay-Based Stability Criteria for Recurrent Neural Networks With Time-Varying Delay,IEEE Transactions on Neural Networks,2010,4ab5e3f4-9b58-4fbb-9bde-ee2f2185cc61
"Search for information is no longer exclusively limited within the native language of the user, but is more and more extended to other languages. This gives rise to the problem of cross-language information retrieval (CLIR), whose goal is to find relevant information written in a different language to a query. In addition to the problems of monolingual information retrieval (IR), translation is the key problem in CLIR: one should translate either the query or the documents from a language to another. However, this translation problem is not identical to full-text machine translation (MT): the goal is not to produce a human-readable translation, but a translation suitable for finding relevant documents. Specific translation methods are thus required. The goal of this book is to provide a comprehensive description of the specifi c problems arising in CLIR, the solutions proposed in this area, as well as the remaining problems. The book starts with a general description of the monolingual IR and CLIR problems. Different classes of approaches to translation are then presented: approaches using an MT system, dictionary-based translation and approaches based on parallel and comparable corpora. In addition, the typical retrieval effectiveness using different approaches is compared. It will be shown that translation approaches specifically designed for CLIR can rival and outperform high-quality MT systems. Finally, the book offers a look into the future that draws a strong parallel between query expansion in monolingual IR and query translation in CLIR, suggesting that many approaches developed in monolingual IR can be adapted to CLIR. The book can be used as an introduction to CLIR. Advanced readers can also find more technical details and discussions about the remaining research challenges in the future. It is suitable to new researchers who intend to carry out research on CLIR.",['Jian-Yun Nie'],108,"['05da32dc-92b9-49a6-86f0-54b6dfc51502', '0d2d8a21-065a-4f1f-a167-4eeb8222ca3c', '17137631-a0ab-48e6-8ffb-607ec171f5a5', '333a3435-4b92-4958-92c9-ec3ac586c063', '34d0159e-4244-474f-a9cf-758b0ebb5ecb', '41fc1b12-bc24-4259-b263-4792ca3572a7', '48bc5327-f3a0-4efc-860f-8ef399c43f77', '49945432-7716-4bbf-af7b-c164405548b3', '5443ee2f-a083-4829-bfd3-b92e50b6d78e', '56bdde8a-8fcf-46e0-a426-ce2d695d4e62', '6741ecf3-e230-44a8-9ad0-a2ca2804b93e', '7f2449b4-c535-4d5a-a322-56cc7cffd463', '808c6e5d-4f8a-4aae-9251-0daa41e97f81', '81e1e9ee-2fa2-42ff-8880-b3c66423f276', '81f773c9-9844-43b5-8a63-f9e1f6e1ace8', '88aac5cb-119b-4c92-8271-d94d51e18b90', '894abe0d-19ac-44cc-9e25-d8f4ce1ee44f', '8cfd8f8d-2580-47e6-8e97-7cb448f292a9', '934cae12-e8ed-4394-aad0-5b0148113804', '9bdbf6d6-db2b-4114-969a-37b4e03993b0', 'a26bb4d3-8093-47e5-b755-efed705c4bbd', 'a3b4fc64-334a-44ac-8485-f8d8ca866fe5', 'b535d6b7-ec76-45d1-a35b-38d38dcaa976', 'c388859a-bdcf-408c-ad63-3754a3b989da', 'cce3336d-27a2-4737-b4df-133d8db7dd71', 'eb306335-b866-47c2-a410-d6d2c177bafe', 'f450b6e2-3ae2-46f2-804a-42d4518d956d', 'f4be32eb-646b-4d3f-aec7-8dad39edb522', 'f8f0f0d6-30e6-4581-8f05-1f6204fd43b3']",Cross-Language Information Retrieval,Synthesis Lectures on Human Language Technologies,2010,4ab5e4bd-08e2-4007-825c-d34ce7cb231f
"I consider the known localized multicast protocol MSTEAM and derive the energy consumed by the multicast tree constructed by this protocol in the best case. Moreover, I show that the length of multicast links connecting into a multicast branch can not be bounded from above. For typical wireless networks where links have a limited communication range, however, I can show that asymptotically the relation between the derived best case energy consumption of MSTEAM and a known lower bound on multicast energy consumption is limited by a factor of 2.",['Hannes Frey'],0,"['23dd7fc0-1ebd-43ce-ab3e-43896512c209', '396dbc21-f0e1-4eca-a6f1-58d50328323e', '4445e24d-0955-434b-a813-a0da3b640ce0', '525b8414-3f0b-42bb-b0ff-e93c2dc22e38', '69a2a38b-6305-47fb-b0a8-3340ef91aeca', '6b1ab2ef-4d38-4bea-b99b-551be4fca283', '8c144323-7cd2-49fc-9cc0-0b2df2c98045', 'f96c1839-0164-41c4-a002-5e72ee9c2c59']",Best case energy analysis of localized euclidean minimum spanning tree based multicasting in ad hoc and sensor networks,modeling analysis and simulation of wireless and mobile systems,2010,4ab60a4a-edc5-4b04-8c17-b7e89e343a28
We describe an automatic quadrature routine which is specifically designed for real functions having a certain type of infinite oscillating tails. The algorithm is designed to integrate a vector function over an infinite interval. A FORTRAN implementation of the algorithm is included.,"['Terje O. Espelid', 'K. J. Overholt']",50,"['78590df2-7681-4c79-af2a-278804493faa', 'f560069c-65bc-4453-b853-a99258613250', 'f92a8869-1eb5-483e-bd8a-b3fee622fa93']",DQAINF: an algorithm for automatic integration of infinite oscillating tails,Numerical Algorithms,1994,4ab60d22-67d1-4683-8648-f1f2601d2ce0
"Interoperability between public administrations receives nowadays a lot of attention. Also in the European Union interworking is high on the priority list, but the challenges to achieve the European administrative space is enormous. Many research projects are undertaken, especially in the domain of semantic interoperability. Many of these efforts seem to start from a technical solution rather than from an actual business problem. By taking a narrow view on the problem space, they only promise limited support for the many challenges in the domain of interoperability and innovation of e-government services. In this paper we present a business driven approach that looks promising in enabling entire classes of interoperability solutions","['A. van Overeem', 'J. Witters', 'Vassilios Peristeras']",50,"['16a62ffc-43be-470c-b54f-d03a3391e757', '26e7aea6-61b1-4960-a796-5941dce73002', 'e776224b-07c2-427c-9a43-1742be3636e9', 'f46050aa-b9e5-4704-ab30-53fbbda7489e', 'fec63482-2b7a-46d7-9b57-717d1a705758']",An Interoperability Framework for Pan-European E-Government Services (PEGS),hawaii international conference on system sciences,2007,4ab62bc1-f71d-4eb3-b468-d5e85025ceb2
"The performance of a multihop wireless network is typically affected by the interference caused by transmissions in the same network. In a statistical fading environment, the interference effects become harder to predict. Information sources in a multihop wireless network can improve throughput and delay performance of data streams by implementing interference-aware packet injection mechanisms. Forcing packets to wait at the head of queues and coordinating packet injections among different sources enable effective control of copacket interference. In this paper, throughput and delay performance in interference-limited multihop networks is analyzed. Using nonlinear probabilistic hopping models, waiting times which jointly optimize throughput and delay performances are derived. Optimal coordinated injection strategies are also investigated as functions of the number of information sources and their separations. The resulting analysis demonstrates the interaction of performance constraints and achievable capacity in a wireless multihop network.","['Ahmed Bader', 'Eylem Ekici']",14,"['0005fd5c-a351-4527-8f92-c05785cbaa1a', '05bf2d5c-d02c-4fba-a284-6274613c4573', '072bf77e-8d9b-4325-9f75-ae52d23ecb2a', '2b837b12-4500-4d40-8b07-7dece11a2563', '54501e11-a547-41e7-bc2c-b1ed416a3960', '886d74c8-abc3-45c8-a7fa-39d492bba528', '8cc9ea80-563f-4e62-bda9-8ff6d71cf6ae', '8e76b153-4a9a-4fa1-b346-1dc3f47ad505', '8f597291-22a7-40f5-9ab5-587ce00bacc5', 'a301962a-6d47-4fcc-9a89-5c67e1fac20f', 'b4543ef2-2b22-4fd8-b9b2-8d75f66cd8b9', 'b5c2c141-a999-46fa-8b97-ef1863e206fc', 'f3977629-ce12-4503-95dd-f57929ca92c9', 'fe9a64a7-aa51-4435-82b7-64fb2a63ed6d']",Performance optimization of interference-limited multihop networks,IEEE\/ACM Transactions on Networking,2008,4ab62e1f-0ed3-42fc-bfd4-64d255150506
"We propose Action-Reaction Learning as an approach for analyzing and synthesizing human behaviour. This paradigm uncovers causal mappings between past and future events or between an action and its reaction by observing time sequences. We apply this method to analyze human interaction and to subsequently synthesize human behaviour. Using a time series of perceptual measurements, a system automatically discovers correlations between past gestures from one human participant (action) and a subsequent gesture (reaction) from another participant. A probabilistic model is trained from data of the human interaction using a novel estimation technique, Conditional Expectation Maximization (CEM). The estimation uses general bounding and maximization to monotonically find the maximum conditional likelihood solution. The learning system drives a graphical interactive character which probabilistically predicts a likely response to a user's behaviour and performs it interactively. Thus, after analyzing human interaction in a pair of participants, the system is able to replace one of them and interact with a single remaining user.","['Tony Jebara', 'Alex Pentland']",76,"['4d9393e3-9936-4bd4-8da2-8d3b0360ef93', '528f4f4d-7995-48ca-8e9a-83182d9d1c36', '56e5ed17-8b83-4493-898c-3282c07c4013', '57eadb55-c2fa-42e1-a0c4-9da5e1658ff9', '5c082884-b447-4c89-bdc7-7fd0c57c4c13', '62f26948-5305-49da-b0e6-c0206afb33dc', '838ef012-ce45-4921-b1eb-4f419462561a', '95c6635e-6828-468b-883a-d4f4723e5a9c', '99cd9eb6-70e8-4b6e-99db-79520995554c', 'c5b62464-c36b-49a5-ab53-563094b25c07']",Action Reaction Learning: Automatic Visual Analysis and Synthesis of Interactive Behaviour,international conference on computer vision systems,1999,4ab63381-d9bd-4be4-aa89-bb5cab20295e
"We propose a general circuit delay model that unifies all previous delay models, e.g. floating, viability, and transition delays, and models introduced in this paper, e.g. delays by sequences of vectors and minimum delays. Then, we formulate the computation of the exact circuit delays, under both bounded and unbounded gate delay models, as a mixed Boolean linear programming using a new formulation technique, called Timed Boolean Function. Next, we compute the exact delays of combinational circuits for transition delay and delay by sequences of vectors. We show that delays by sequences of vectors and floating (or viability) delays are invariant under both bounded and unbounded gate delay models. Finally, we address the effect of gate delay lower bounds on delays of circuits. We demonstrate the effectiveness of the method by giving exact delay results for all ISCAS benchmark circuits (except C6188).","['William K. C. Lam', 'Robert K. Brayton', 'Alberto L. Sangiovanni-Vincentelli']",36,"['11c3d880-e165-46fc-8462-5428b6ee00a3', '1ec1d469-0c63-436d-b8f3-47a059a32d5b', '45be70e4-4354-4716-8643-251297163803', '839169dd-a9aa-4390-9dbe-7d89cd742eb5', '85d678ec-49c8-4828-9400-4543c1ce99bc']",Circuit Delay Models and Their Exact Computation Using Timed Boolean Functions,design automation conference,1993,4ab63e25-5d11-4658-838d-199c55886b17
"In this paper we present a probabilistic calculus for formally modeling and reasoning about Mobile Ad Hoc Networks (MANETs) with unreliable connections and mobility of nodes. In our calculus, a MANET node can locally broadcast messages to a group of nodes within its physical transmission range. The group probability is also introduced since two distinct nodes within different groups should receive messages from the same sender with different possibilities. Our calculus naturally captures essential features of MANETs, i.e., local broadcast, mobility and probability. Moreover, we give a formal operational semantics of the calculus in terms of the labeled transition system and define the notion of open bisimulation. Finally, we illustrate our calculus with a toy example.","['Si Liu', 'Yongxin Zhao', 'Huibiao Zhu', 'Qin Li']",3,"['29b15320-3963-4548-8c97-7489949ed089', '362a03d8-55d9-4f60-90ac-d5e3280efd16', '56647d93-fa06-4218-9bb1-ec2feed125c3', '6d974303-0b90-46f8-82ba-4911d135da1e', '6f647cb8-fc9c-4507-8c51-ec1feb70b5e9', '776c609f-eb2a-44f1-bff9-a9fc69b91b9d', '9979a23d-3394-4c52-8582-0072b4b6e6d9']",Towards a Probabilistic Calculus for Mobile Ad Hoc Networks,theoretical aspects of software engineering,2011,4ab717e9-32e7-4647-9e51-81b66414a761
"Slow motion replay is a special effect used in the video entertainment field. It consists in a presentation of a video scene at a rate display lower than the original. Already consolidated as a commercial feature of analog video players, today slow motion is likely to be extended to the digital environment. Purpose of this paper is to present a technique combining fractals (I. F. S.) and wavelets to obtain a subjectively pleasant zoom and slow motion of digital video sequences. Active scene detection and post processing techniques are used to reduce computational cost and improve visual quality respectively. This study shows that the proposed technique produces better results than the state of the art techniques based either on data replication or classical interpolation.","['Daniele D. Giusto', 'Maurizio Murroni', 'Giulio Soro']",50,"['44433e99-1124-4705-9d79-110aa268bc65', 'a321def6-2a6e-4642-99e9-35eed64c4d01', 'b5753a3a-e668-4fa4-84ea-be447ab83ff3']",Slow motion replay of video sequences using fractal zooming,IEEE Transactions on Consumer Electronics,2005,4ab71fdd-c0cc-498e-8deb-84cbdb2b2448
